{
  "$schema": "http://json-schema.org/draft-04/schema#",
  "type": "object",
  "properties": {
    "path": {
      "type": "string"
    },
    "separator": {
      "type": ["string", "null"]
    },
    "event_log_format": {
      "type": "string",
      "enum": [
        "atomic",
        "interval"
      ]
    },
    "sorted": {
      "type": "boolean"
    },
    "row_id_column": {
      "type": ["string", "null"]
    },
    "job_column": {
      "type": ["string", "null"]
    },
    "machine_column": {
      "type": ["string", "null"]
    },
    "resource_columns": {
      "type": ["null","array"],
      "items": [
        {
          "type": "string"
        }
      ]
    },
    "transaction_type_column": {
      "type": ["string", "null"]
    },
    "time_attributes": {
      "type": "array",
      "items": [
        {
          "type": "string"
        }
      ]
    },
    "relative_time": {
      "type": "boolean"
    },
    "time_format": {
      "type": "string"
    },
    "activity_instance_column": {
      "type": ["string", "null"]
    },
    "group_attributes": {
      "type": ["null","array"],
      "items": [
        {
          "type": "string"
        }
      ]
    },


    "start_transaction_types": {
      "type": ["null","array"],
      "items": [
        {
          "type": "string"
        }
      ]
    },
    "complete_transaction_types": {
      "type": ["null","array"],
      "items": [
        {
          "type": "string"
        }
      ]
    }
  },
  "required": [
    "path",
    "event_log_format",
    "sorted",
    "row_id_column",
    "job_column",
    "machine_column",
    "resource_columns",
    "transaction_type_column",
    "time_attributes",
    "relative_time",
    "time_format",
    "activity_instance_column",
    "group_attributes",


    "start_transaction_types",
    "complete_transaction_types"
  ]
}