{
    "path": "test/data/event_log.csv",
    "separator" : ";",
    "event_log_format" : "atomic",
    "sorted" : true,    
    "row_id_column" : null,   
    "job_column" : "Job",            
    "machine_column" : "Machine",   
    "resource_columns" : [
        "Resource"
    ],     
    "transaction_type_column" : "Transaction_Type", 
    "time_attributes": [
        "Timestamp"
    ],
    "relative_time" : true,
    "time_format" : "%H:%M:%S",
    "activity_instance_column" : null,
    "group_attributes" : [
        "Job",
        "Machine",
        "Resource"
    ],
    
    "start_transaction_types" : [
        "start"
    ],
    "complete_transaction_types" : [
        "complete"
    ]
}